{
  "schema_version": "jepa_adapter_signals/v1",
  "experiment_type": "jepa_anchor_ablation",
  "run_id": "2026-02-13T224000Z_jepa-anchor-ablation_seed47_ema_anchor_on",
  "adapter": {
    "name": "ree_jepa_adapter",
    "version": "v1+dispatch.v1"
  },
  "stream_presence": {
    "z_t": true,
    "z_hat": true,
    "pe_latent": true,
    "uncertainty_latent": false,
    "trace_context_mask_ids": true,
    "trace_action_token": false
  },
  "pe_latent_fields": [
    "mean",
    "p95"
  ],
  "uncertainty_estimator": "none",
  "signal_metrics": {
    "latent_prediction_error_mean": 0.10447527564214425,
    "latent_prediction_error_p95": 0.2132598682799585,
    "latent_residual_coverage_rate": 0.8984261483649757,
    "precision_input_completeness_rate": 1.0
  }
}
